{
  "invocationId": "11111111-1111-4111-8111-111111111111",
  "observationId": "22222222-2222-4222-8222-222222222222",
  "bodyEvidenceId": null,
  "receiptEvidenceId": "33333333-3333-4333-8333-333333333333",
  "contextHash": "aaaaaaaaaaaaaaaaaaaaaaaaaaaaaaaaaaaaaaaaaaaaaaaaaaaaaaaaaaaaaaaa",
  "state": "unknown",
  "reason": "transport_failed",
  "policyVersion": "discovery-v1",
  "parserVersion": "robots-v1",
  "freshUntil": "2026-09-19T00:00:00.000Z"
}
